line,verse,part,text
299,75,4,คิดก็เปนอนิจจังเสียทั้งนั้น
300,76,1,ขอเดชะพระเจดีย์คิรีมาศ
301,76,2,บรรจุธาตุที่ตั้งนรังสรรค์
302,76,3,ข้าอุส่าห์มาเคารพอภิวันท์
303,76,4,เปนอนันต์อานิสงส์ดำรงกาย
304,77,1,จะเกิดชาติใดใดในมนุษย์
305,77,2,ให้บริสุทธสมจิตรที่คิดหมาย
306,77,3,ทั้งทุกข์โศกโรคไภยอย่าใกล้กราย
307,77,4,แสนสบายบริบูรณ์ประยูรวงค์
308,78,1,ทั้งโลโภโทโสแลโมหะ
309,78,2,ให้ชนะใจได้อย่าใหลหลง
310,78,3,ขอฟุ้งเฟื่องเรืองวิชาปัญญายง
311,78,4,ทั้งให้ทรงศีลขันธ์ในสันดาน
312,79,1,อีกสองสิ่งหญิงร้ายแลชายชั่ว
313,79,2,อย่าเมามัวหมายรักสมัคสมาน
314,79,3,ขอสมหวังตั้งประโยชน์โพธิญาณ
315,79,4,ตราบนิพพานภาคน่าให้ถาวร
316,80,1,พอกราบพระปะดอกประทุมชาต
317,80,2,พบพระธาตุสถิตย์ในเกสร
318,80,3,สมถวิลยินดีชุลีกร
319,80,4,ประคองช้อนเชิญองค์ลงนาวา
320,81,1,กับหนูพัดมัสการสำเร็จแล้ว
321,81,2,ใส่ขวดแก้ววางไว้ใกล้เกษา
322,81,3,มานอนกรุงรุ่งขึ้นจะบูชา
323,81,4,ไม่ปะตาตันอกยิ่งตกใจ
324,82,1,แสนเสียดายหมายจะชมบรมธาตุ
325,82,2,ใจจะขาดคิดมาน้ำตาไหล
326,82,3,โอ้บุญน้อยลอยลับครรไลไกล
327,82,4,เสียน้ำใจเจียนจะดิ้นสิ้นชีวัน
328,83,1,สุดจะอยู่ดูอื่นไม่ฝืนโศก
329,83,2,กำเริบโรคร้อนฤไทยเฝ้าใฝ่ฝัน
330,83,3,พอกรู่กรู่สุริฉายขึ้นพรายพรรณ
331,83,4,ให้ล่องวันหนึ่งมาถึงธานี
332,84,1,ประทับท่าน่าอรุณอารามหลวง
333,84,2,ค่อยสร่างทรวงทรงศีลพระชินศรี
334,84,3,นิราศเรื่องเมืองเก่าของเรานี้
335,84,4,ไว้เปนที่โสมนัสทัศนา
336,85,1,ด้วยได้ไปเคารพพระพุทธรูป
337,85,2,ทั้งสถูปบรมธาตุพระสาสนา
338,85,3,เปนนิไสยไว้เหมือนเตือนศรัทธา
339,85,4,ตามภาษาไม่สบายพอคลายใจ
340,86,1,ใช่จะมีที่รักสมัคมาด
341,86,2,แรมนิราศร้างมิตรพิศมัย
342,86,3,ซึ่งครวญคร่ำทำทีพิรี้พิไร
343,86,4,ตามนิไสยกาพย์กลอนแต่ก่อนมา
344,87,1,เหมือนแม่ครัวขั้วแกงแพนงผัด
345,87,2,สารพัดเพียญฉนังเครื่องมังสา
346,87,3,อันพริกไทยใบผักชีเหมือนสีกา
347,87,4,ต้องโรยหน้าเสียสักหน่อยอร่อยใจ
348,88,1,จงทราบความตามจริงทุกสิ่งสิ้น
349,88,2,อย่านึกนินทาแกล้งแหนงไฉน
350,88,3,นักเลงกลอนนอนเปล่าก็เศร้าใจ
351,88,4,จึงร่ำไรเรื่องร้างเล่นบ้างเอย
